{
  "providerInstanceId": "11111111-1111-4111-8111-111111111111",
  "endpointGeneration": "42",
  "sessionId": "session-reconnected-42",
  "manifestRevision": "sha256:aaaaaaaaaaaaaaaaaaaaaaaaaaaaaaaaaaaaaaaaaaaaaaaaaaaaaaaaaaaaaaaa",
  "disposition": "ADMISSION_DISPOSITION_RESOLVED_EXISTING",
  "record": {
    "operationId": "22222222-2222-4222-8222-222222222222",
    "requestFingerprint": "sha256:9d52f77a7f678fda81dcee97df7b3bc5e4877ee570285f6aa5741b83d4c731df",
    "admittedAt": "2026-09-19T12:00:00Z",
    "recordExpiresAt": "2026-09-20T12:00:00Z",
    "admittedEndpointGeneration": "42"
  }
}
